id,source_id,name_ko,name_en,suitable_skin_types,suitable_skin_types_confidence,target_concerns,target_concerns_confidence,duration_minutes,session_count,downtime_days,price_min,price_max,description_ko,description_en,precautions_ko,precautions_en,aftercare_ko,aftercare_en,is_approved,review_notes
226878d1-53f8-57aa-b002-08e947cf8c96,treat-inmode-body-tightening,인모드 바디 타이트닝,InMode Body Tightening,normal|dry|oily|combination|sensitive,0.7,,0.2,45,2~4회 (4~8주 간격),1,150000,400000,InMode Body Tightening uses radiofrequency energy to stimulate collagen production and improve skin elasticity. You can expect noticeable body contouring results with minimal downtime and a relatively quick treatment time.,InMode Body Tightening uses radiofrequency energy to stimulate collagen production and improve skin elasticity. You can expect noticeable body contouring results with minimal downtime and a relatively quick treatment time.,"Avoid blood thinners like aspirin or ibuprofen before treatment. Expect some swelling and bruising, typically with a 1-3 day recovery period. If you're traveling, schedule your treatment early in your trip, minimize sun exposure post-treatment, and avoid strenuous activities.","Avoid blood thinners like aspirin or ibuprofen before treatment. Expect some swelling and bruising, typically with a 1-3 day recovery period. If you're traveling, schedule your treatment early in your trip, minimize sun exposure post-treatment, and avoid strenuous activities.","After treatment, diligently apply sunscreen and avoid saunas, hot springs, and alcohol. You can usually resume normal activities immediately, but contact your provider if you experience excessive redness or itching. Pay extra attention to soothing your skin while traveling.","After treatment, diligently apply sunscreen and avoid saunas, hot springs, and alcohol. You can usually resume normal activities immediately, but contact your provider if you experience excessive redness or itching. Pay extra attention to soothing your skin while traveling.",,
e75eaf61-e7fa-525b-9b70-993caf9d954d,treat-body-lifting-laser,바디 리프팅 레이저,Body Lifting Laser,,0,wrinkles,0.75,45,2~4회 (4~8주 간격),2,200000,500000,"The Body Lifting Laser uses laser energy to improve elasticity in sagging skin. By stimulating collagen production, it delivers a natural lifting effect. Recovery is minimal, allowing you to quickly return to your daily activities.","The Body Lifting Laser uses laser energy to improve elasticity in sagging skin. By stimulating collagen production, it delivers a natural lifting effect. Recovery is minimal, allowing you to quickly return to your daily activities.","Prior to treatment, ensure a thorough skin assessment and consultation with a specialist. Expect a 1-3 day recovery period. If receiving treatment while traveling, minimize sun exposure and avoid strenuous activities.","Prior to treatment, ensure a thorough skin assessment and consultation with a specialist. Expect a 1-3 day recovery period. If receiving treatment while traveling, minimize sun exposure and avoid strenuous activities.","After treatment, diligently apply sunscreen and avoid saunas, hot springs, and alcohol. You can resume light activities after a few days. Contact the clinic if you experience significant swelling or redness.","After treatment, diligently apply sunscreen and avoid saunas, hot springs, and alcohol. You can resume light activities after a few days. Contact the clinic if you experience significant swelling or redness.",,
3fda40de-000a-592d-8c2f-3c08788ff2e5,treat-scalp-scaling,두피 스케일링,Scalp Scaling,oily|normal|combination|sensitive|dry,0.75,dryness|pores|redness,0.65,60,"주 1회, 8~12회",0,50000,120000,"Scalp scaling deeply cleanses pores and removes buildup, promoting a healthier scalp. Expect a refreshed scalp and improved hair growth potential. There's virtually no downtime, allowing you to return to your routine immediately.","Scalp scaling deeply cleanses pores and removes buildup, promoting a healthier scalp. Expect a refreshed scalp and improved hair growth potential. There's virtually no downtime, allowing you to return to your routine immediately.","Consult with a specialist if you have scalp inflammation or open wounds before treatment. If you're a tourist, allow for 1-2 days of relaxation afterward. Avoid direct and intense sun exposure immediately following the procedure.","Consult with a specialist if you have scalp inflammation or open wounds before treatment. If you're a tourist, allow for 1-2 days of relaxation afterward. Avoid direct and intense sun exposure immediately following the procedure.","Avoid saunas, hot springs, and alcohol for one week post-treatment. Shampoo as usual, gently massaging your scalp. If you experience excessive redness or itching, consult a doctor. You can generally resume normal activities the next day.","Avoid saunas, hot springs, and alcohol for one week post-treatment. Shampoo as usual, gently massaging your scalp. If you experience excessive redness or itching, consult a doctor. You can generally resume normal activities the next day.",,
f599736c-203c-5f7a-8532-9936e83805d5,treat-hair-mesotherapy,헤어 메조테라피,Hair Mesotherapy,normal|oily|dry|combination|sensitive,0.7,dryness,0.5,45,"주 1회, 8~12회",0,100000,250000,"Hair Mesotherapy involves direct injection of beneficial ingredients into the scalp to stimulate hair growth and scalp health. Effective for preventing hair loss and strengthening hair, it typically involves a short recovery period.","Hair Mesotherapy involves direct injection of beneficial ingredients into the scalp to stimulate hair growth and scalp health. Effective for preventing hair loss and strengthening hair, it typically involves a short recovery period.","Allow for a potential 1-3 day recovery period after the procedure. If planning this treatment during travel, minimize sun exposure and avoid strenuous activities. Schedule your appointment thoughtfully to accommodate your travel itinerary.","Allow for a potential 1-3 day recovery period after the procedure. If planning this treatment during travel, minimize sun exposure and avoid strenuous activities. Schedule your appointment thoughtfully to accommodate your travel itinerary.","For a few days post-treatment, avoid strong sunlight, saunas, hot springs, and alcohol. You can typically resume normal activities after a few days. Consult a professional immediately if you notice any unusual symptoms on your scalp.","For a few days post-treatment, avoid strong sunlight, saunas, hot springs, and alcohol. You can typically resume normal activities after a few days. Consult a professional immediately if you notice any unusual symptoms on your scalp.",,
cf8fc8ef-21a9-5953-bed6-e36231d140e0,treat-prp-hair-rejuvenation,PRP 모발 재생,PRP Hair Regeneration,normal|dry|oily|combination|sensitive,0.6,dryness,0.2,45,"주 1회, 8~12회",1,200000,500000,"PRP Hair Regeneration uses your own platelet-rich plasma to stimulate hair growth. The procedure involves injecting PRP into the scalp to boost hair density and slow hair loss. Expect minimal downtime, typically with some redness post-treatment.","PRP Hair Regeneration uses your own platelet-rich plasma to stimulate hair growth. The procedure involves injecting PRP into the scalp to boost hair density and slow hair loss. Expect minimal downtime, typically with some redness post-treatment.","Avoid aspirin or anticoagulants before the procedure. Expect a 1-3 day recovery period with possible redness. If you are a tourist, schedule your treatment early in your trip to allow for rest, and minimize sun exposure immediately after the procedure.","Avoid aspirin or anticoagulants before the procedure. Expect a 1-3 day recovery period with possible redness. If you are a tourist, schedule your treatment early in your trip to allow for rest, and minimize sun exposure immediately after the procedure.","Avoid strenuous exercise and alcohol for a few days post-treatment. Refrain from saunas and hot springs. Normal activities can resume quickly, but contact the clinic if you experience excessive redness or swelling. Protect your scalp with sunscreen when outdoors.","Avoid strenuous exercise and alcohol for a few days post-treatment. Refrain from saunas and hot springs. Normal activities can resume quickly, but contact the clinic if you experience excessive redness or swelling. Protect your scalp with sunscreen when outdoors.",,
7a6b76fb-2c24-54ec-8104-826b317b3bb8,treat-hydrafacial,하이드라페이셜,HydraFacial,dry|oily|combination|sensitive|normal,0.95,acne|pores|dryness|dullness|uneven_tone|redness,0.85,45,2~4주 간격 반복,0,80000,200000,"HydraFacial deeply cleanses, exfoliates, and hydrates the skin, delivering immediate and noticeable results. This non-invasive treatment revitalizes the complexion with minimal downtime.","HydraFacial deeply cleanses, exfoliates, and hydrates the skin, delivering immediate and noticeable results. This non-invasive treatment revitalizes the complexion with minimal downtime.","Avoid using harsh exfoliants prior to your HydraFacial. Expect mild redness for 1-2 days post-treatment. If you're traveling, schedule your appointment well in advance of important events and minimize sun exposure afterwards. Consider activity intensity when planning the procedure.","Avoid using harsh exfoliants prior to your HydraFacial. Expect mild redness for 1-2 days post-treatment. If you're traveling, schedule your appointment well in advance of important events and minimize sun exposure afterwards. Consider activity intensity when planning the procedure.","Following your HydraFacial, diligently apply sunscreen and avoid saunas and hot springs. Limit alcohol consumption to prevent inflammation. You can generally resume normal activities the next day. Monitor for any unusual redness or itching and consult a doctor if needed.","Following your HydraFacial, diligently apply sunscreen and avoid saunas and hot springs. Limit alcohol consumption to prevent inflammation. You can generally resume normal activities the next day. Monitor for any unusual redness or itching and consult a doctor if needed.",,
ad040358-8442-5957-865a-26bd3c8c7b83,treat-thread-lift,실리프팅 (쓰레드 리프트),Thread Lift,normal|dry|oily|combination|sensitive,0.7,wrinkles|dullness,0.9,60,1~2회 (12~18개월 유지),7,300000,1500000,"A Thread Lift uses special threads to instantly lift and tighten the skin, improving elasticity. This quick procedure offers noticeable results and relatively fast recovery. Expect a natural-looking lifting effect.","A Thread Lift uses special threads to instantly lift and tighten the skin, improving elasticity. This quick procedure offers noticeable results and relatively fast recovery. Expect a natural-looking lifting effect.","Please note that a 1-3 day recovery period may be needed. If you are visiting from abroad, schedule your treatment with ample time and minimize sun exposure. Avoid alcohol and aspirin intake before the procedure.","Please note that a 5-7 days recovery period may be needed. If you are visiting from abroad, schedule your treatment with ample time and minimize sun exposure. Avoid alcohol and aspirin intake before the procedure.","For the first few days after your Thread Lift, avoid strong sunlight, saunas, hot springs, and alcohol. Light activities are generally fine, but strenuous exercise should be avoided for about a week. Contact the clinic if you experience excessive swelling, bruising, or persistent pain.","For the first few days after your Thread Lift, avoid strong sunlight, saunas, hot springs, and alcohol. Light activities are generally fine, but strenuous exercise should be avoided for about a week. Contact the clinic if you experience excessive swelling, bruising, or persistent pain.",,
fbb16de8-238e-5ae4-92e2-58b878dc4a03,treat-vitamin-iv-drip-glutathione,비타민 수액 (글루타치온 IV),Vitamin Drip (Glutathione IV),dry|oily|combination|sensitive|normal,0.6,dullness|dark_spots|uneven_tone,0.75,30,1~2주 간격 (여행 중 1회도 가능),0,50000,200000,"This Glutathione IV drip delivers skin brightening and antioxidant benefits directly into your bloodstream. With a quick treatment time and no downtime, experience a radiant complexion from within.","This Glutathione IV drip delivers skin brightening and antioxidant benefits directly into your bloodstream. With a quick treatment time and no downtime, experience a radiant complexion from within.","A consultation with a doctor is essential to determine the right treatment plan for you. Mild bruising or swelling may occur with a 1-3 day recovery period. If you're visiting, schedule your treatment early in your trip and minimize sun exposure afterwards.","A consultation with a doctor is essential to determine the right treatment plan for you. Mild bruising or swelling may occur with a minimal downtime (a few hours). If you're visiting, schedule your treatment early in your trip and minimize sun exposure afterwards.","Protect your skin from the sun after treatment, and avoid alcohol, saunas, and hot springs for a few days. You can generally resume normal activities within a few days, but contact your doctor if you experience excessive redness, itching, or other unusual symptoms. Maintain good hygiene practices, especially while traveling.","Protect your skin from the sun after treatment, and avoid alcohol, saunas, and hot springs for a few days. You can generally resume normal activities within a few days, but contact your doctor if you experience excessive redness, itching, or other unusual symptoms. Maintain good hygiene practices, especially while traveling.",,
